{"$schema":"https://json-schema.org/draft/2020-12/schema","type":"object","required":["investigation_id","files","preregistration","result_receipt"],"properties":{"investigation_id":{"type":"string"},"files":{"type":"array","minItems":1,"items":{"type":"object","required":["path","sha256"],"properties":{"path":{"type":"string"},"sha256":{"type":"string","pattern":"^[a-f0-9]{64}$"}}}},"preregistration":{"type":"string"},"result_receipt":{"type":"string"}},"additionalProperties":false}
