{"investigation_id":"ecoli-regression-2026","files":[{"path":"data/raw/data_set-full.anc.txt","sha256":"cca2444865e9f823882447a4b31cbe7c28b0227d4ab3f30b20aa0fd3471c57bb"},{"path":"data/raw/data_set-full.ev.change.txt","sha256":"11e2233ebe5d4b2560d475359f2682484bebc51d6d3ff0a38ebef6a3b02b9ed8"}],"preregistration":"experiments/ecoli-regression/preregistration-v2.json","result_receipt":"verification/ecoli-final-result.json"}
